{
  "schemaVersion": 1,
  "runId": "run_example01",
  "sessionId": "session-test-01",
  "testedHead": "bbbbbbbbbbbbbbbbbbbbbbbbbbbbbbbbbbbbbbbb",
  "status": "pass",
  "commands": [
    {
      "commandId": "contracts",
      "startedAt": "2026-09-01T12:31:00Z",
      "completedAt": "2026-09-01T12:31:02Z",
      "exitCode": 0,
      "timedOut": false,
      "stdout": { "path": "evidence/test/contracts.stdout", "sha256": "7777777777777777777777777777777777777777777777777777777777777777", "mediaType": "text/plain", "kind": "command", "commandId": "contracts" },
      "stderr": { "path": "evidence/test/contracts.stderr", "sha256": "8888888888888888888888888888888888888888888888888888888888888888", "mediaType": "text/plain", "kind": "command", "commandId": "contracts" }
    },
    {
      "commandId": "tests",
      "startedAt": "2026-09-01T12:31:02Z",
      "completedAt": "2026-09-01T12:31:05Z",
      "exitCode": 0,
      "timedOut": false,
      "stdout": { "path": "evidence/test/tests.stdout", "sha256": "9999999999999999999999999999999999999999999999999999999999999999", "mediaType": "text/plain", "kind": "command", "commandId": "tests" },
      "stderr": { "path": "evidence/test/tests.stderr", "sha256": "aaaaaaaaaaaaaaaaaaaaaaaaaaaaaaaaaaaaaaaaaaaaaaaaaaaaaaaaaaaaaaaa", "mediaType": "text/plain", "kind": "command", "commandId": "tests" }
    }
  ],
  "failures": [],
  "completedAt": "2026-09-01T12:31:05Z"
}
